id,name,overview,genres,number_of_seasons,number_of_episodes,first_air_date,last_air_date,networks,vote_count,vote_average,languages,popularity,backdrop_path,watchlisted_rating
162,The Expanse,A thriller set two hundred years in the future following the case of a missing young woman who brings a hardened detective and a rogue ship's captain together in a race across the solar system to expose the greatest conspiracy in human history.,"['Drama', 'Mystery', 'Sci-Fi']",6,62,2015-12-14,2022-01-13,"['Syfy', 'Prime Video']",2058,8.054,['en'],106.253,/fYX29Hf2effFV4bOhhiKMkKNRUG.jpg,0.898299371058875
163,The Fresh Prince of Bel-Air,"Will, a street-smart teenager, moves from the tough streets of West Philly to posh Bel-Air to live with his Uncle Philip, Aunt Vivian, his cousins — spoiled Hilary, preppy Carlton and young Ashley — and their sophisticated British butler, Geoffrey. Though Will’s antics and upbringing contrast greatly with the upper-class lifestyle of his extended relatives, he soon finds himself right at home as a loved part of the family.","['Comedy', 'Family']",6,148,1990-09-10,1996-05-20,['NBC'],2056,7.955,['en'],130.923,/uxUT6MjhMkpaijKKJHh24W5VWDw.jpg,0.8863951971764694
164,Superman & Lois,"After years of facing megalomaniacal supervillains, monsters wreaking havoc on Metropolis, and alien invaders intent on wiping out the human race, The Man of Steel aka Clark Kent and Lois Lane come face to face with one of their greatest challenges ever: dealing with all the stress, pressures and complexities that come with being working parents in today's society.","['Sci-Fi', 'Drama']",3,43,2021-02-23,2023-06-27,['The CW'],2047,8.1,['en'],157.443,/qO8uNvhYrBRKKWZLUdHrvwuuQpG.jpg,0.8986011322091365
165,NCIS,"From murder and espionage to terrorism and stolen submarines, a team of special agents investigates any crime that has a shred of evidence connected to Navy and Marine Corps personnel, regardless of rank or position.","['Crime', 'Drama', 'Action']",20,457,2003-09-23,2023-05-22,['CBS'],2047,7.631,['en'],754.614,/qmcoEOrTm6BcgR4iO7KBQKE9AKT.jpg,0.8465710172701136
166,Bridgerton,"Wealth, lust, and betrayal set in the backdrop of Regency era England, seen through the eyes of the powerful Bridgerton family.",['Drama'],3,24,2020-12-25,2022-03-25,['Netflix'],2045,8.143,,-5.0,/aXa6J5vGZQQOLZZv8fK0w0cd2fm.jpg,0.9024888542123706
167,Heroes,Common people discover that they have super powers. Their lives intertwine as a devastating event must be prevented.,"['Sci-Fi', 'Drama']",4,78,2006-09-25,2010-02-08,['NBC'],2018,7.487,,64.842,/4DgAubucJP6y2yX2Yx4CLEgdIPA.jpg,0.8188287728433001
168,Chicago Fire,"An edge-of-your-seat view into the lives of everyday heroes committed to one of America's noblest professions. For the firefighters, rescue squad and paramedics of Chicago Firehouse 51, no occupation is more stressful or dangerous, yet so rewarding and exhilarating. These courageous men and women are among the elite who forge headfirst into danger when everyone else is running the other way and whose actions make the difference between life and death.",['Drama'],11,239,2012-10-10,2023-05-24,['NBC'],2008,8.4,['en'],257.093,/a1axm2xRYGB35X406AMI51IrhYp.jpg,0.914128174154164
169,Homeland,"CIA officer Carrie Mathison is tops in her field despite being bipolar, which makes her volatile and unpredictable. With the help of her long-time mentor Saul Berenson, Carrie fearlessly risks everything, including her personal well-being and even sanity, at every turn.","['Drama', 'War & Politics']",8,96,2011-10-02,2020-04-26,['Showtime'],1969,7.544,['en'],90.782,/391ixi0wVbFtFLQnOy8ZncWv2io.jpg,0.8050289449533792
170,The Kardashians,"The family you know and love is here with a brand new series, giving an all-access pass into their lives. Kris, Kourtney, Kim, Khloé, Kendall, and Kylie bring the cameras back to reveal the truth behind the headlines. From the intense pressures of running billion-dollar businesses to the hilarious joys of playtime and school drop-offs, this series brings viewers into the fold with a rivetingly honest story of love & life in the spotlight.",['Reality'],4,40,2022-04-14,2023-09-28,['Hulu'],1968,8.63,['en'],86.223,/hEUigxkQ6JTsKDUab8TL8trGOAc.jpg,0.9204495499742966
171,Ozark,"A financial adviser drags his family from Chicago to the Missouri Ozarks, where he must launder $500 million in five years to appease a drug boss.","['Crime', 'Drama']",4,44,2017-07-21,2022-04-29,['Netflix'],1968,8.244,['en'],68.006,/gD830J0sf5gEeZvzkRVPdGxJmSR.jpg,0.8792799640774162
172,Locked Up: The Oasis,"After a few years dedicating themselves to robbing jewelers, banks and casinos, it is time for Macarena and Zulema to separate.",['Drama'],1,8,2020-04-20,2020-06-08,['FOX España'],1966,7.86,['es'],20.921,/7wm4CH6LbsFul4wWmmfXGcStVsk.jpg,0.8374717371254565
173,The Haunting of Hill House,"The Crains, a fractured family, confront haunting memories of their old home and the terrifying events that drove them from it.","['Mystery', 'Drama']",1,10,2018-10-12,2018-10-12,['Netflix'],1953,8.1,['en'],47.223,/6YANELLOCepacNcfJ9lj43NvvrZ.jpg,0.8573365956054926
174,Once Upon a Time,"There is a town in Maine where every story book character you've ever known is trapped between two worlds, victims of a powerful curse. Only one knows the truth and only one can break the spell.    Emma Swan is a 28-year-old bail bonds collector who has been supporting herself since she was abandoned as a baby. Things change for her when her son Henry, whom she abandoned years ago, finds her and asks for her help explaining that she is from a different world where she is Snow White's missing daughter.","['Drama', 'Sci-Fi']",7,156,2011-10-23,2018-05-18,['ABC'],1948,7.315,['en'],625.792,/4043WFrLsGnZa3RL4Po9buc1EtF.jpg,0.7722668322537624
175,Halo,"Depicting an epic 26th-century conflict between humanity and an alien threat known as the Covenant, the series weaves deeply drawn personal stories with action, adventure and a richly imagined vision of the future.","['Action', 'Sci-Fi']",1,9,2022-03-24,2022-05-19,['Paramount+'],1926,8.3,['en'],91.325,/1qpUk27LVI9UoTS7S0EixUBj5aR.jpg,0.8663601644845402
176,Pasión de Gavilanes,The Reyes-Elizondo's idyllic lives are shattered by a murder charge against Eric and León.,['Drama'],2,259,2003-10-21,2022-05-31,['Telemundo'],1925,7.641,['es'],283.197,/qabMMIpNUUKYFqQxHEWErEEBD8G.jpg,0.7971591463918455
177,The Wire,"Told from the points of view of both the Baltimore homicide and narcotics detectives and their targets, the series captures a universe in which the national war on drugs has become a permanent, self-sustaining bureaucracy, and distinctions between good and evil are routinely obliterated.","['Crime', 'Drama']",5,60,2002-06-02,2008-03-09,['HBO'],1889,8.535,"['es', 'en', 'el', 'zh']",77.897,/oggnxmvofLtGQvXsO9bAFyCj3p6.jpg,0.8737749367138907
178,El juego de las llaves,"A casual encounter between Adriana and Sergio, two former high school friends, triggers the beginning of the game of the keys where four couples generate new sexual and emotional combinations in a dangerous and lustful game.",['Drama'],2,18,2019-08-16,2021-09-30,['Pantaya'],9999,7.483,['es'],25.334,/b3YoKUxr9fHNLgWEplNBYCtBy8K.jpg,0.7616149021102112
179,Sex and the City,"Based on the bestselling book by Candace Bushnell, Sex and thezCity tells the story of four best friends, all single and in their late thirties, as they pursue their careers and talk about their sex lives, all while trying to survive the New York social scene. ",['Comedy'],6,94,1998-06-06,2004-02-22,['HBO'],1871,7.4,['en'],91.846,/mXtL24G2Awyl3lKFtreMHnH5qFC.jpg,0.7503598832310083
180,American Dad!,"The series focuses on an eccentric motley crew that is the Smith family and their three housemates: Father, husband, and breadwinner Stan Smith; his better half housewife, Francine Smith; their college-aged daughter, Hayley Smith; and their high-school-aged son, Steve Smith. Outside of the Smith family, there are three additional main characters, including Hayley's boyfriend turned husband, Jeff Fischer; the family's man-in-a-goldfish-body pet, Klaus; and most notably the family's zany alien, Roger, who is ""full of masquerades, brazenness, and shocking antics.""","['Animation', 'Comedy']",20,366,2005-02-06,2023-10-02,"['FOX', 'TBS']",1861,6.952,['en'],196.512,/mc3rG5M9dFVjMfaCFNfbD5gu2pK.jpg,0.7011650115707084
181,"Sex, Explained","From the biology of attraction to the history of birth control, explore the ins and outs of sex in this entertaining and enlightening series.",['Documentary'],1,5,2020-01-02,2020-01-02,['Netflix'],1856,6.553,['en'],17.276,/dPDuW7NL3iTNjiTsEhb30n89au4.jpg,0.659146939221153
182,Gossip Girl,An exclusive group of privileged teens from a posh prep school on Manhattan's Upper East Side whose lives revolve around the blog of the all-knowing albeit ultra-secretive Gossip Girl.,"['Drama', 'Mystery']",6,121,2007-09-19,2012-12-17,['The CW'],1852,8.302,['en'],102.347,/zVF9VSQ5GypVD9uRlM95O1LcVr3.jpg,0.8332739620438019
183,InuYasha,"Kagome Higurashi is a modern day young girl who lives with her family by the old Higure shrine. Unbeknownst to Kagome, she is the reincarnation of priestess Kikyo and posseses the ""Jewel of Four Souls"" (the Shikon jewel). One ill-fated day, Kagome locates an ancient well near her home and is abruptly transported through the well and into a feudal Japan, inhabited by demons. There, she encounters Inuyasha, son of a powerful demon father and a human mother, who is pinned to a tree by an enchanted arrow.","['Animation', 'Sci-Fi', 'Action', 'Comedy', 'Mystery']",2,193,2000-10-16,2010-03-30,"['ANIMAX', 'Nippon TV', 'YTV']",1851,8.587,['ja'],89.589,/gtFE5NhVHpa9oX1PU9szsUS8ZPX.jpg,0.8614141106310357
184,Love Alarm,"Love Alarm is an app that tells you if someone within a 10-meter radius has a crush on you. It quickly becomes a social phenomenon. While everyone talks about it and uses it to test their love and popularity, Jojo is one of the few people who have yet to download the app. However, she soon faces a love triangle situation between Sun-oh whom she starts to have feelings for, and Hye-young, who has had a huge crush on her.","['Drama', 'Sci-Fi']",2,14,2019-08-22,2021-03-12,['Netflix'],1843,8.402,"['en', 'ko', 'pt']",28.929,/mXouvrZbn8YpZMURGvw30QK8qfo.jpg,0.839212825256437
185,The Legend of Korra,"Avatar Korra, a headstrong, rebellious, feisty young woman who continually challenges and breaks with tradition, is on her quest to become a fully realized Avatar. In this story, the Avatar struggles to find balance within herself.","['Action', 'Animation', 'Drama', 'Family', 'Sci-Fi']",4,52,2012-04-14,2014-12-18,['Nickelodeon'],1841,8.253,['en'],47.604,/hmrNfrUl3FFaymDj6Iw5oKQjIs2.jpg,0.8234357789676316
9999,Firefly,"In the year 2517, after the arrival of humans in a new star system, follow the adventures of the renegade crew of Serenity, a ""Firefly-class"" spaceship. The ensemble cast portrays the nine characters who live on Serenity.","['Drama', 'Action', 'Sci-Fi']",1,11,2002-09-20,2002-12-20,['FOX'],1830,8.331,['en'],43.565,/leEGz2TzhnfzEoPJJlf0ZWbozBR.jpg,0.8262516202183743
187,Lupin,"Inspired by the adventures of Arsène Lupin, gentleman thief Assane Diop sets out to avenge his father for an injustice inflicted by a wealthy family.","['Crime', 'Drama', 'Mystery']",2,17,2021-01-08,2021-06-11,['Netflix'],1824,7.769,['fr'],124.785,/aY7zv2pfk9H0QxaaL3PBjvalbKQ.jpg,0.767987330193912
188,She-Hulk: Attorney at Law,"Jennifer Walters navigates the complicated life of a single, 30-something attorney who also happens to be a green 6-foot-7-inch superpowered hulk.","['Comedy', 'Sci-Fi']",1,9,2022-08-18,2022-10-13,['Disney+'],1816,6.378,['en'],45.06,/eljErfkQUcFUgQkI4I1soZcH8MW.jpg,0.6277178217176265
189,The Wheel of Time,"Follow Moiraine, a member of the shadowy and influential all-female organization called the “Aes Sedai” as she embarks on a dangerous, world-spanning journey with five young men and women. Moiraine believes one of them might be the reincarnation of an incredibly powerful individual, whom prophecies say will either save humanity or destroy it.","['Sci-Fi', 'Drama']",2,16,2021-11-18,2023-09-28,['Prime Video'],1809,7.74,['en'],489.993,/oahCTL082gwu6fYrxEOBe546uvB.jpg,0.7588284890750919
190,The Crown,"The gripping, decades-spanning inside story of Her Majesty Queen Elizabeth II and the Prime Ministers who shaped Britain's post-war destiny.     The Crown tells the inside story of two of the most famous addresses in the world – Buckingham Palace and 10 Downing Street – and the intrigues, love lives and machinations behind the great events that shaped the second half of the 20th century. Two houses, two courts, one Crown.",['Drama'],6,55,2016-11-04,2022-11-09,['Netflix'],1794,8.236,['en'],52.673,/63u7DCLSWo8TNBZUhu7fEXj6kX1.jpg,0.800760932362612
191,Regular Show,"Two bored groundskeepers, Mordecai (a six-foot-tall blue jay) and Rigby (a hyperactive raccoon) are best friends who spend their days trying to entertain themselves by any means necessary, much to the displeasure of their boss. Their everyday pursuits often lead to things spiraling out of control and into the surreal.","['Animation', 'Comedy']",8,257,2010-09-06,2017-01-16,['Cartoon Network'],1783,8.655,['en'],190.447,/5iWJwQPBusPTV7G7n5TABNRP7tO.jpg,0.8363393198778425
192,Dragon Ball GT,"Ten years have passed since Goku left his friends and family to hone his skills. But Goku soon finds himself helpless against the mystical power of the Dragon Balls and an accidental wish made by the devious Emperor Pilaf. The wish; that Goku once again become a child! Goku, together with Trunks, and his own granddaughter Pan, blast off into the outer reaches of space in search of the mysterious Blackstar Dragon Balls. But these Dragon Balls have a fatal secret: if not collected within one year Earth will be destroyed.","['Animation', 'Action', 'Sci-Fi']",1,64,1996-02-07,1997-11-19,['Fuji TV'],1783,7.678,['ja'],18.346,/aJOlYXjxb5IvnTsO4I1tmFpC7GH.jpg,0.7419310569638448
193,Twin Peaks,The body of Laura Palmer is washed up on a beach near the small Washington state town of Twin Peaks. FBI Special Agent Dale Cooper is called in to investigate her strange demise only to uncover a web of mystery that ultimately leads him deep into the heart of the surrounding woodland and his very own soul.,"['Drama', 'Mystery']",3,48,0000-00-00,2017-09-03,"['ABC', 'Showtime']",1775,8.295,"['nn', 'en', 'af', 'is']",197.043,/j5w04XEuFv85N3RIovXBJIHxjSb.jpg,0.7979558218424281
194,La Reina del Sur,"After years of blood, sweat and tears, a woman of humble origin ends up becoming a drug trafficking legend, with all that that means...","['Drama', 'Crime']",3,183,2011-02-28,32/13/2021,['Telemundo'],1769,7.839,['es'],107.222,/mWGLIaVFXyalsSbstiwletjKFUC.jpg,0.7515408597441814
195,Yellowstone,"Follow the violent world of the Dutton family, who controls the largest contiguous ranch in the United States. Led by their patriarch John Dutton, the family defends their property against constant attack by land developers, an Indian reservation, and America’s first National Park.","['Western', 'Drama']",5,47,2018-06-20,2023-01-01,['Paramount Network'],1768,8.2,['en'],442.49,/xHkOKPUe3ioXyPIe5odyL6o6cp4.jpg,0.78570625934461
196,Star Wars: The Clone Wars,"Yoda, Obi-Wan Kenobi, Anakin Skywalker, Mace Windu and other Jedi Knights lead the Grand Army of the Republic against the droid army of the Separatists.","['Action', 'Animation', 'Sci-Fi']",7,133,2008-10-03,2020-05-04,"['Cartoon Network', 'Netflix', 'Disney+']",1767,8.474,['en'],629.948,/m6eRgkR1KC6Mr6gKx6gKCzSn6vD.jpg,0.8115010929574249
197,Fullmetal Alchemist: Brotherhood,"Edward and Alphonse Elric's reckless disregard for alchemy's fun­damental laws ripped half of Ed's limbs from his body and left Al's soul clinging to a cold suit of armor. To restore what was lost, the brothers scour a war-torn land for the Philosopher's Sto­ne, a fabled relic which grants the ability to perform alchemy in impossible ways.    The Elrics are not alone in their search; the corrupt State Military is also eager to harness the artifact's power. So too are the strange Homunculi and their shadowy creator. The mythical gem lures exotic alchemists from distant kingdoms, scarring some deeply enough to inspire murder. As the Elrics find their course altered by these enemies and allies, their purpose remains unchanged – and their bond unbreakable.","['Action', 'Animation', 'Sci-Fi']",1,64,2009-04-05,2010-07-04,"['MBS', 'TBS', 'CBC', 'SBS TV']",1749,8.699,['ja'],318.286,/A6tMQAo6t6eRFCPhsrShmxZLqFB.jpg,0.8245618553290059
198,Jurassic World Camp Cretaceous,Six teens attending an adventure camp on the opposite side of Isla Nublar must band together to survive when dinosaurs wreak havoc on the island.,"['Animation', 'Kids', 'Action']",5,49,2020-09-18,2022-07-21,['Netflix'],1745,8.031,"['en', 'pt', 'th']",38.434,/4WIglfr4lDFVjCEcXzCeu6cJsOh.jpg,0.7595024114715543
199,Drake & Josh,"Fifteen-year-old Drake and Josh are schoolmates, but not close friends. Drake views Josh as weird and a bit of a goof. So, imagine Drake's shock when he finds out that this ""goof"" is about to become his new step-brother and roommate when his mother marries Josh's father. A spin off of The Amanda Show.",['Comedy'],4,57,2004-01-11,2007-09-16,['Nickelodeon'],1736,8.371,['en'],77.958,/tiDbvFzWZU2UzToqBazDf3hDe7S.jpg,0.7875736232442886
200,The Sandman,"After years of imprisonment, Morpheus — the King of Dreams — embarks on a journey across worlds to find what was stolen from him and restore his power.","['Sci-Fi', 'Drama']",1,11,2022-08-05,2022-08-19,['Netflix'],1726,8.064,['en'],64.168,/eqhKMZTLcieAvoH6CBqknTTfNby.jpg,0.754319631198448
