id,name,overview,genres,number_of_seasons,number_of_episodes,first_air_date,last_air_date,networks,vote_count,vote_average,languages,popularity,backdrop_path,watchlisted_rating
106,"Love, Death & Robots","Terrifying creatures, wicked surprises and dark comedy converge in this NSFW anthology of animated stories presented by Tim Miller and David Fincher.","['Animation', 'Sci-Fi']",3,35,2019-03-15,2022-05-20,['Netflix'],2804,-5.0,['en'],113.607,/hkkR14vBgGV4TM0e7BGlMcAQETS.jpg,1.2558345231166328
107,It,"In 1960, seven outcast kids known as ""The Losers' Club"" fight an evil demon who poses as a child-killing clown. Thirty years later, they reunite to stop the demon once and for all when it returns to their hometown.","['Mystery', 'Drama']",1,2,1990-11-18,1990-11-20,['ABC'],2794,6.905,['en'],61.231,/1YXUpm1Nkx9frbYKFw6YVfv6btV.jpg,1.045572578071132
108,Jujutsu Kaisen,"Yuji Itadori is a boy with tremendous physical strength, though he lives a completely ordinary high school life. One day, to save a classmate who has been attacked by curses, he eats the finger of Ryomen Sukuna, taking the curse into his own soul. From then on, he shares one body with Ryomen Sukuna. Guided by the most powerful of sorcerers, Satoru Gojo, Itadori is admitted to Tokyo Jujutsu High School, an organization that fights the curses... and thus begins the heroic tale of a boy who became a curse to exorcise a curse, a life from which he could never turn back.","['Animation', 'Action', 'Sci-Fi']",1,47,2020-10-03,2023-09-29,"['MBS', 'TBS', 'CBC', 'Tulip Television', 'SBC', 'BSN', 'tys', 'HBC', 'RKK Kumamoto Broadcasting', 'Nagasaki Culture Telecasting Corporation', 'i-Television', 'SBS TV', 'IBC Iwate Broadcasting', 'Broadcasting System of San-in', 'Hokuriku Broadcasting', 'Oita Broadcasting System', 'TV-U Fukushima', 'RSK', 'TV-U Yamagata', 'Tohoku Broadcasting', 'RKB', 'TV Kochi Broadcasting', 'Ryukyu Broadcasting', 'TV Yamanashi', 'RCC', 'MRT Miyazaki Broadcasting', 'ATV', 'MBC South Japan Broadcasting']",2788,8.563,['ja'],614.553,/lthkKBLe1rX6iThgVFg22O02sJw.jpg,1.29384667283998
109,Dragon Ball,"Long ago in the mountains, a fighting master known as Gohan discovered a strange boy whom he named Goku. Gohan raised him and trained Goku in martial arts until he died. The young and very strong boy was on his own, but easily managed. Then one day, Goku met a teenage girl named Bulma, whose search for the mystical Dragon Balls brought her to Goku's home. Together, they set off to find all seven and to grant her wish.","['Animation', 'Action', 'Sci-Fi']",1,153,1986-02-26,1989-04-19,['Fuji TV'],2788,8.2,['ja'],7.884,/nokCMxb0u5YtLsu7RGs4oUiA8DK.jpg,1.2389983320434237
110,You,"A dangerously charming, intensely obsessive young man goes to extreme measures to insert himself into the lives of those he is transfixed by.",['Drama'],5,40,2018-09-09,2023-03-09,"['Lifetime', 'Netflix']",2788,8.078,['en'],71.284,/2ZNFu0hkSVtAI6LRWGIlCPNd1Tj.jpg,1.2205644544203385
111,True Detective,"An American anthology police detective series utilizing multiple timelines in which investigations seem to unearth personal and professional secrets of those involved, both within or outside the law.",['Drama'],4,30,2014-01-12,2019-02-24,['HBO'],2787,8.305,['en'],76.26,/scx72FpTF929jYXea0MphyE24Wa.jpg,
112,The End of the F***ing World,"James is 17 and is pretty sure he is a psychopath. Alyssa, also 17, is the cool and moody new girl at school. The pair make a connection and she persuades him to embark on a darkly comedic road trip in search of her real father.","['Comedy', 'Drama', 'Crime']",2,16,2017-10-24,2019-11-07,['Channel 4'],2786,8.094,['en'],31.754,/nfWhNM5VVd9a5bEGobs83TWTuLM.jpg,1.222104693624798
113,El Señor de los Cielos,"Set in the 1990s, these are the life and times of Amado Carrillo Fuentes, a man who became the head of the Juárez cartel. Nicknamed “El Señor de los Cielos” (Lord of the Skies) because of the large fleet of airplanes he used to transport drugs, he was also known for washing more than $200 million through Colombia to finance his huge fleet. He is described as the most powerful drug trafficker of his time.","['Crime', 'Drama', 'Soap']",8,699,2013-04-15,2023-05-22,['Telemundo'],2777,7.909,['es'],14.76,/iN9uULLaSx7h21tcR9io2dnARjw.jpg,1.190314037214412
114,Legacies,"In a place where young witches, vampires, and werewolves are nurtured to be their best selves in spite of their worst impulses, Klaus Mikaelson’s daughter, 17-year-old Hope Mikaelson, Alaric Saltzman’s twins, Lizzie and Josie Saltzman, among others, come of age into heroes and villains at The Salvatore School for the Young and Gifted.","['Sci-Fi', 'Drama']",4,68,2018-10-25,2022-06-16,['The CW'],2769,8.496,['en'],148.914,/fRYwdeNjMqC30EhofPx5PlDpdun.jpg,1.2749746779146838
115,SpongeBob SquarePants,"Deep down in the Pacific Ocean in the subterranean city of Bikini Bottom lives a square yellow sponge named SpongeBob SquarePants. SpongeBob lives in a pineapple with his pet snail, Gary, loves his job as a fry cook at the Krusty Krab, and has a knack for getting into all kinds of trouble without really trying. When he's not getting on the nerves of his cranky next door neighbor Squidward, SpongeBob can usually be found smack in the middle of all sorts of strange situations with his best buddy, the simple yet lovable starfish, Patrick, or his thrill-seeking surfer-girl squirrel pal, Sandy Cheeks.","['Animation', 'Comedy', 'Family', 'Sci-Fi']",14,578,1999-05-01,2023-08-09,['Nickelodeon'],2747,7.617,['en'],47.867,/aasp5EmwclAQbwfGABWLTNLhjwB.jpg,1.133983446514901
116,The X-Files,"The exploits of FBI Special Agents Fox Mulder and Dana Scully who investigate X-Files: marginalized, unsolved cases involving paranormal phenomena. Mulder believes in the existence of aliens and the paranormal while Scully, a skeptic, is assigned to make scientific analyses of Mulder's discoveries that debunk Mulder's work and thus return him to mainstream cases.","['Sci-Fi', 'Mystery', 'Crime']",11,218,1993-09-10,2018-03-21,['FOX'],2726,8.397,['en'],643.863,/1vpmGGDaW4aUGKCfQTV0ygAPtBu.jpg,1.240549518760878
117,Sin senos sí hay paraíso,A young woman born in a mafia-controlled town seeks revenge on those who wrongfully harmed and imprisoned her family.,"['Action', 'Crime', 'Drama', 'Mystery']",4,340,2016-07-19,2020-12-03,['Telemundo'],2676,7.541,['es'],113.424,/oAkpvVvoyZWMo9cpNk3aQoVKsjM.jpg,1.0936519957093989
118,Doctor Who,"The Doctor is a Time Lord: a 900 year old alien with 2 hearts, part of a gifted civilization who mastered time travel. The Doctor saves planets for a living—more of a hobby actually, and the Doctor's very, very good at it.","['Action', 'Drama', 'Sci-Fi']",13,153,2005-03-26,2021-12-05,['BBC One'],9999,7.4,['en'],173.153,/sRfl6vyzGWutgG0cmXmbChC4iN6.jpg,1.0583643676358263
119,iZombie,"A medical student who becomes a zombie joins a Coroner's Office in order to gain access to the brains she must reluctantly eat so that she can maintain her humanity. But every brain she eats, she also inherits their memories and must now solve their deaths with help from the Medical examiner and a police detective.","['Drama', 'Crime', 'Sci-Fi']",5,71,2015-03-17,2019-08-01,['The CW'],2628,7.797,['en'],65.145,/tCjXy1iCsr2BVlNczafnkZ40LPn.jpg,1.1104959909502872
120,Sons of Anarchy,"An adrenalized drama with darkly comedic undertones that explores a notorious outlaw motorcycle club’s (MC) desire to protect its livelihood while ensuring that their simple, sheltered town of Charming, California remains exactly that, charming. The MC must confront threats from drug dealers, corporate developers, and overzealous law officers. Behind the MC’s familial lifestyle and legally thriving automotive shop is a ruthless and illegal arms business driven by the seduction of money, power, and blood.","['Crime', 'Drama']",7,92,2008-09-03,2014-12-09,['FX'],2569,8.445,['en'],376.377,/sAX6JOWZWJGhkvFRctSZIL556mp.jpg,1.1757848448201416
121,Goblin,"In his quest for a bride to break his immortal curse, a 939-year-old guardian of souls meets a grim reaper and a sprightly student with a tragic past.","['Drama', 'Sci-Fi', 'Comedy']",1,16,2016-12-02,2017-01-21,['tvN'],2545,8.66,['ko'],52.348,/uoA7xBzCt3XXqL5fMmB8pmYgABJ.jpg,1.1944549611023485
122,Gravity Falls,"Twin brother and sister Dipper and Mabel Pines are in for an unexpected adventure when they spend the summer helping their great uncle Stan run a tourist trap in the mysterious town of Gravity Falls, Oregon.","['Animation', 'Comedy', 'Mystery', 'Sci-Fi', 'Kids']",2,40,2012-06-15,2016-02-15,"['Disney Channel', 'Disney XD']",2512,8.531,['en'],300.167,/lhg7eA6CTOCL10QNVdKiyxkgPsL.jpg,
123,Narcos,A gritty chronicle of the war against Colombia's infamously violent and powerful drug cartels.,"['Crime', 'Drama']",3,30,2015-08-28,2017-09-01,['Netflix'],2493,8.006,"['es', 'en']",76.746,/go5LNIFH9IdoSwv8j9cNyTk2uPU.jpg,1.0816878814835686
124,Txtans,A team of young superheroes led by Nightwing (formerly Batman's first Robin) form to combat evil and other perils.,"['Action', 'Sci-Fi', 'Drama']",4,49,2018-10-12,2023-05-11,"['DC Universe', 'HBO Max']",2487,7.975,"['en', 'de']",92.504,/remQq0nfQoxY9fVglGGegHZjFxx.jpg,1.074906222357191
125,Adventure Time,"Hook up with Finn and Jake as they travel the Land of Ooo searching for adventure. But remember, adventure isn’t always easy. Sometimes you’ve got to battle fire gnomes that torture old ladies, save a smelly hot dog princess from the Ice King, and thaw out a bunch of frozen businessmen. What the cabbage?!","['Animation', 'Comedy', 'Sci-Fi']",10,279,2010-04-05,2018-09-03,['Cartoon Network'],2474,8.477,['en'],316.301,/pe4B3OYBb7qYCdkAz7nKWordbls.jpg,1.1365956206674608
126,The Handmaid's Tale,"Set in a dystopian future, a woman is forced to live as a concubine under a fundamentalist theocratic dictatorship. A TV adaptation of Margaret Atwood's novel.","['Drama', 'Sci-Fi']",5,56,2017-04-26,2022-11-09,['Hulu'],2457,8.2,['en'],684.333,/sokTOq0zAmPS7wCR4qd4Kca35x7.jpg,1.0919006104127302
127,Pretty Little Liars,"Based on the Pretty Little Liars series of young adult novels by Sara Shepard, the series follows the lives of four girls — Spencer, Hanna, Aria, and Emily — whose clique falls apart after the disappearance of their queen bee, Alison. One year later, they begin receiving messages from someone using the name ""A"" who threatens to expose their secrets — including long-hidden ones they thought only Alison knew.","['Drama', 'Mystery']",7,161,2010-06-08,2017-06-27,"['ABC Family', 'Freeform']",9999,8.028,['en'],509.785,/ypLoTftyF5EpGBxJas4PThIdiU4.jpg,1.055074694176618
128,House of Cards,"Set in present day Washington, D.C., House of Cards is the story of Frank Underwood, a ruthless and cunning politician, and his wife Claire who will stop at nothing to conquer everything. This wicked political drama penetrates the shadowy world of greed, sex and corruption in modern D.C.",['Drama'],6,73,2013-02-01,2018-11-02,['Netflix'],2403,8.045,['en'],67.655,/ex4kvQb0Ski5KL2fsnKQU2hV3oo.jpg,1.0477168273365949
129,Outlander,"The story of Claire Randall, a married combat nurse from 1945 who is mysteriously swept back in time to 1743, where she is immediately thrown into an unknown world where her life is threatened. When she is forced to marry Jamie, a chivalrous and romantic young Scottish warrior, a passionate affair is ignited that tears Claire's heart between two vastly different men in two irreconcilable lives.","['Drama', 'Sci-Fi']",8,83,2014-08-09,2023-08-11,['Starz'],2403,8.217,"['fr', 'gd', 'en']",141.529,/nf3Vlxm3C9U1aKUUQHmKFZmxPSc.jpg,1.07011673961775
130,Moon Knight,"When Steven Grant, a mild-mannered gift-shop employee, becomes plagued with blackouts and memories of another life, he discovers he has dissociative identity disorder and shares a body with mercenary Marc Spector. As Steven/Marc’s enemies converge upon them, they must navigate their complex identities while thrust into a deadly mystery among the powerful gods of Egypt.","['Action', 'Sci-Fi', 'Mystery']",1,6,2022-03-30,2022-05-04,['Disney+'],2392,7.816,['en'],49.843,/iux1vKPT7Vw1AzetZb4Jz6wfYsm.jpg,1.0132341666417637
131,Modern Family,"The Pritchett-Dunphy-Tucker clan is a wonderfully large and blended family. They give us an honest and often hilarious look into the sometimes warm, sometimes twisted, embrace of the modern family.",['Comedy'],11,250,2009-09-23,2020-04-08,['ABC'],2346,7.841,['en'],168.723,/x4lxFIhhrDI4nWtV8osnYwbGESV.jpg,0.9969274666673432
132,Peacemaker,"The continuing story of Peacemaker – a compellingly vainglorious man who believes in peace at any cost, no matter how many people he has to kill to get it – in the aftermath of the events of “The Suicide Squad.”","['Action', 'Sci-Fi', 'Drama']",1,-1,2022-01-13,2022-02-17,['HBO Max'],2334,8.326,['en'],49.988,/ctxm191q5o3axFzQsvNPlbKoSYv.jpg,1.053176980735965
133,Locked Up,"Set up to take the blame for corporate fraud, young Macarena Ferreiro is locked up in a high-security women's prison surrounded by tough, ruthless criminals in this tense, provocative Spanish thriller.",['Drama'],4,40,2015-04-20,2019-02-04,"['FOX España', 'Antena 3']",2318,8.017,"['pt', 'es']",104.169,/iukGFUQQWUdgwTGGDLb1Pw3GoZP.jpg,1.0071390032931096
134,Blindspot,"A vast international plot explodes when a beautiful Jane Doe is discovered naked in Times Square, completely covered in mysterious, intricate tattoos with no memory of who she is or how she got there. But there's one tattoo that is impossible to miss: the name of FBI agent Kurt Weller, emblazoned across her back. ""Jane,"" Agent Weller and the rest of the FBI quickly realize that each mark on her body is a crime to solve, leading them closer to the truth about her identity and the mysteries to be revealed.","['Crime', 'Drama', 'Action']",5,100,2015-09-21,2020-07-23,['NBC'],2293,7.378,['en'],67.007,/u7G2G7jrBfHfIyj8ifzkq8I4tq3.jpg,0.9168679789656436
135,Boruto: Naruto Next Generations,"The life of the shinobi is beginning to change. Boruto Uzumaki, son of Seventh Hokage Naruto Uzumaki, has enrolled in the Ninja Academy to learn the ways of the ninja. Now, as a series of mysterious events unfolds, Boruto’s story is about to begin!","['Action', 'Animation']",1,293,2017-04-05,2023-03-26,['TV Tokfo'],2293,7.89,['??'],149.166,/3XlKckxPEa4lg5w4vHnyE35PUyI.jpg,0.9804944909242246
136,The Sopranos,"The story of New Jersey-based Italian-American mobster Tony Soprano and the difficulties he faces as he tries to balance the conflicting requirements of his home life and the criminal organization he heads. Those difficulties are often highlighted through his ongoing professional relationship with psychiatrist Jennifer Melfi. The show features Tony's family members and Mafia associates in prominent roles and story arcs, most notably his wife Carmela and his cousin and protégé Christopher Moltisanti.",['Drama'],6,86,1999-01-10,2007-06-10,['HBO'],2292,8.6,['en'],156.471,/lNpkvX2s8LGB0mjGODMT4o6Up7j.jpg,1.0682604858178926
137,Seven Deadly Sins,"The series traces the history of the seven deadly sins, how they became part of religious doctrine, and looks at historical figures who have been the worst perpetrators of each. Each of the seven sins is explored, from their origins and nature, their opposing virtue, and their corresponding punishment.",['Documentary'],1,7,2008-12-29,2009-01-04,['History'],2282,7.7,['en'],7.537,/6GdneIKJFjv5ArM5b6kKJQ4o8z4.jpg,0.9522927219296908
138,Fargo,"A close-knit anthology series dealing with stories involving malice, violence and murder based in and around Minnesota.","['Crime', 'Drama']",5,51,2014-04-15,2020-11-29,['FX'],2278,8.313,['en'],133.703,/FtK35pwgGHTFu8hySVlFmfF8td.jpg,1.0263030041590686
139,Shameless,"Chicagoan Frank Gallagher is the proud single dad of six smart, industrious, independent kids, who without him would be... perhaps better off. When Frank's not at the bar spending what little money they have, he's passed out on the floor. But the kids have found ways to grow up in spite of him. They may not be like any family you know, but they make no apologies for being exactly who they are.","['Drama', 'Comedy']",11,134,2011-01-09,2021-04-11,['Showtime'],2268,8.2,['en'],271.993,/bFVx0ydejF6NE8SEAVz95ns0o6A.jpg,1.007908255765597
140,Control Z,"When a hacker begins releasing students' secrets to the entire high school, the socially isolated but observant Sofía works to uncover his/her identity.",['Drama'],3,24,2020-05-22,2022-07-06,['Netflix'],2242,8.227,['es'],20.708,/gFFedWBZ7s5sPiR9A1IpileWuFf.jpg,0.9996344289398396
141,Dahmer – Monster: The Jeffrey Dahmer Story,This series examines the gruesome and horrific true crimes of Jeffrey Dahmer and the systemic failures that enabled one of America’s most notorious serial killers to continue his murderous spree in plain sight for over a decade.,"['Crime', 'Drama']",1,10,2022-09-21,2022-09-21,['Netflix'],2228,8.061,['en'],59.532,/5vUux2vNUTqwCzb7tVcH18XnsF.jpg,0.9733481495456722
142,The Book of Boba Fett,Legendary bounty hunter Boba Fett and mercenary Fennec Shand must navigate the galaxy’s underworld when they return to the sands of Tatooine to stake their claim on the territory once ruled by Jabba the Hutt and his crime syndicate.,"['Action', 'Sci-Fi']",1,7,2021-12-29,2022-02-09,['Disney+'],2223,7.71,['en'],47.62,/oMWnpUUCeIqvTdP3IYZ0JnPdrmU.jpg,0.9288764251995404
143,Orange Is the New Black,"A crime she committed in her youthful past sends Piper Chapman to a women's prison, where she trades her comfortable New York life for one of unexpected camaraderie and conflict in an eccentric group of fellow inmates.","['Comedy', 'Drama']",-1,91,2013-07-11,2019-07-26,['Netflix'],2222,7.688,['en'],103.656,/z8Mg3YVZGd1iSnoDinEAoh9WTck.jpg,0.9258092789104064
144,The Lord of the Rings: The Rings of Power,"Beginning in a time of relative peace, we follow an ensemble cast of characters as they confront the re-emergence of evil to Middle-earth. From the darkest depths of the Misty Mountains, to the majestic forests of Lindon, to the breathtaking island kingdom of Númenor, to the furthest reaches of the map, these kingdoms and characters will carve out legacies that live on long after they are gone.","['Action', 'Sci-Fi', 'Drama']",1,8,2022-09-01,2022-10-13,['Prime Video'],2210,7.408,"['en', 'tr']",127.962,/1rO4xoCo4Z5WubK0OwdVll3DPYo.jpg,0.8872731660403768
145,Marvel's The Punisher,A former Marine out to punish the criminals responsible for his family's murder finds himself ensnared in a military conspiracy.,"['Action', 'Crime', 'Drama']",2,26,2017-11-17,2019-01-18,['Netflix'],2207,8.119,['en'],48.888,/j5aOOtsJinQtyRaqiB12TTRHdeX.jpg,0.9711112257890196
146,Spartacus,"Torn from his homeland and the woman he loves, Spartacus is condemned to the brutal world of the arena where blood and death are primetime entertainment.",['Drama'],3,33,2010-01-22,2013-04-12,['Starz'],2192,7.997,['en'],163.932,/xyHrlFr8W9bGysDsYQRRfD3cdoR.jpg,0.9500178070512106
147,Chicago P.D.,"A riveting police drama about the men and women of the Chicago Police Department's District 21 who put it all on the line to serve and protect their community. District 21 is made up of two distinctly different groups: the uniformed cops who patrol the beat and go head-to-head with the city's street crimes and the Intelligence Unit that combats the city's major offenses - organized crime, drug trafficking, high profile murders and beyond.","['Crime', 'Drama']",10,208,2014-01-08,2023-05-24,['NBC'],2186,8.453,['en'],755.394,/qSrSg6dZeZy6uJ6SfSKbEAwk3Wo.jpg,1.0014404434102622
148,Marvel's Iron Fist,"Danny Rand resurfaces 15 years after being presumed dead. Now, with the power of the Iron Fist, he seeks to reclaim his past and fulfill his destiny.","['Action', 'Drama', 'Sci-Fi']",2,23,2017-03-17,2018-09-07,['Netflix'],2179,6.529,['en'],10.22,/xHCfWGlxwbtMeeOnTvxUCZRGnkk.jpg,0.7710241811376801
149,Fast & Furious Spy Racers,A government agency recruits teen driver Tony Toretto and his thrill-seeking friends to infiltrate a criminal street racing circuit as undercover spies.,"['Animation', 'Action', 'Kids', 'Family']",6,52,2019-12-26,2021-12-17,['Netflix'],2166,6.976,['en'],41.373,/9aWSpBqMrlrr8yaydSEgNJjIruG.jpg,0.818896517354404
150,9-1-1,"Explore the high-pressbre experiences of police officers, paramedics and firefighters who are thrust into the most frightening, shocking and heart-stopping situations. These emergency responders must try to balance saving those who are at their most vulnerable with solving the problems in their own lives.","['Drama', 'Crime', 'Action']",6,96,2018-01-03,2023-05-15,['FOX'],2165,8.224,['en'],239.165,/w6H16UchlNJ4Okiu1Qasa0btOAk.jpg,0.9649506483404432
151,See,"A virus has decimated humankind. Those who survived emerged blind. Centuries later when twins are born with the mythic ability to see, their father must protect his tribe against a threatened queen.","['Drama', 'Sci-Fi', 'Action']",3,24,2019-11-01,2022-10-13,['Apple TV+'],2163,8.2,['en'],197.199,/wNKwOtq27yfN13SKKV07NwkpBA3.jpg,0.96124583651719
152,Fringe,"FBI Special Agent Olivia Dunham, brilliant but formerly institutionalized scientist Walter Bishop and his scheming, reluctant son Peter uncover a deadly mystery involving a series of unbelievable events and realize they may be a part of a larger, more disturbing pattern that blurs the line between science fiction and technology.","['Sci-Fi', 'Drama', 'Mystery']",5,100,2008-09-09,2013-01-18,['FOX'],2154,8.119,['en'],190.366,/2yZXtM2Kky1Sy0kachbDlwybl3y.jpg,0.9477904759173305
153,DC's Legends of Tomorrow,"When heroes alone are not enough ... the world needs legends. Having seen the future, one he will desperately try to prevent from happening, time-traveling rogue Rip Hunter is tasked with assembling a disparate group of both heroes and villains to confront an unstoppable threat — one in which not only is the planet at stake, but all of time itself. Can this ragtag team defeat an immortal threat unlike anything they have ever known?","['Action', 'Sci-Fi', 'Drama']",7,110,2016-01-21,2022-03-02,['The CW'],2130,7.332,['en'],173.189,/isPWZirQUCHpQ8aJZHa5s3EVXv1.jpg,0.8463814952258492
154,Young Sheldon,"The early life of child genius Sheldon Cooper, later seen in The Big Bang Theory.","['Comedy', 'Family']",6,127,2017-09-25,2023-05-18,['CBS'],2124,8.057,['en'],297.324,/fXRgyxFxT3SG45fDqUODDRNE9IJ.jpg,0.9274531401190506
155,The Pacific,"Track the intertwined real-life stories of three U.S. Marines – Robert Leckie, John Basilone, and Eugene Sledge – across the vast canvas of the Pacific Theater during World War II. A companion piece to the 2001 miniseries Band of Brothers.","['Drama', 'Action', 'War & Politics']",1,10,2010-03-14,2010-05-16,['HBO'],2123,7.738,['en'],57.386,/nWfpVLgioDXQsAbfL6UJxYz6d3d.jpg,0.8903132145250693
156,Hannibal,"Both a gift and a curse, Graham has the extraordinary ability to think like his prey—he sees what they see, feels what they feel. But while Graham is pursuing an especially troubling, cannibalistic murderer, Special Agent Jack Crawford teams him with a highly respected psychiatrist – a man with a taste for the criminal minded – Dr. Hannibal Lecter.","['Drama', 'Crime']",3,39,2013-04-04,2015-08-27,['NBC'],2121,8.23,['en'],41.747,/mCwQJqyuCFlbFyJR5sWg3PqtHEN.jpg,0.9460293354110628
157,Mindhunter,An agent in the FBI's Elite Serial Crime Unit develops profiling techniques as he pursues notorious serial killers and rapists.,"['Drama', 'Crime']",-1,19,2017-10-13,2019-08-16,['Netflix'],2099,8.069,['en'],39.398,/a906PH7CDmSOdS7kmnAgdWk5mhv.jpg,0.917901868596308
158,BoJack Horseman,"Meet the most beloved sitcom horse of the 90s - 20 years later. BoJack Horseman was the star of the hit TV show ""Horsin' Around,"" but today he's washed up, living in Hollywood, complaining about everything, and wearing colorful sweaters.","['Animation', 'Comedy', 'Drama']",6,76,2014-08-22,2020-01-31,['Netflix'],2083,8.558,['en'],78.876,/AmIHaw6CQWOfBCQYom15Jzsu7OB.jpg,0.9661079413725344
159,Tokyo Ghoul,"Ken Kaneki is a bookworm college student who meets a girl names Rize at a cafe he frequents. They're the same age and have the same interests, so they quickly become close. Little does Kaneki know that Rize is a ghoul – a kind of monster that lives by hunting and devouring human flesh. When part of her special organ – ""the red child"" – is transplanted into Kaneki, he becomes a ghoul himself, trapped in a warped world where humans are not the top of the food chain.","['Action', 'Animation', 'Drama', 'Mystery']",4,48,2014-07-04,2018-12-25,['Tokyo MX'],2072,8.374,['ja'],79.344,/yOarY3Yo0NMkuTuft87M5oAZa3C.jpg,0.9403441076480008
160,Charmed,"Three sisters (Prue, Piper and Phoebe) reunite and unlock their powers to become the Charmed Ones, the most powerful good witches of all time, whose prophesied destiny is to protect innocent lives from evil beings such as demons and warlocks. Each sister possesses unique magical powers that grow and evolve, while they attempt to maintain normal lives in modern day San Francisco. ","['Comedy', 'Drama', 'Mysthry', 'Sci-Fi']",8,178,32/13/2021,2006-05-21,['The WB'],2068,8.189,['en'],130.029,/ueZFcwAUvkjyAB9beaiqJyg0M8H.jpg,0.917794615486328
161,Marvel's Jessica Jones,"After a tragic ending to her short-lived super hero stint, Jessica Jones is rebuilding her personal life and career as a detective who gets pulled into cases involving people with extraordinary abilities in New York City.","['Sci-Fi', 'Drama']",3,39,2015-11-20,2019-06-14,['Netflix'],2059,7.529,['en'],28.684,/fjEOQhzZk2Or7VYUBeMx5ZIwU95.jpg,0.840151764180338
